{
  "backdrop": {
    "background": "radial-gradient(1200px 800px at 50.2% 50%, #05172d, #031016 75%)"
  },
  "finishing": {
    "gradeExposure": 0,
    "gradeContrast": 0,
    "gradeSaturation": 1,
    "gradeTemperature": 0,
    "gradeTint": 0,
    "gradeHighlights": 0,
    "gradeShadows": 0,
    "gradeVignette": 0,
    "gradeBloom": 0,
    "gradeBloomThreshold": 0.6
  },
  "audio": {
    "bed": {
      "src": "asset://c50127ee-3950-4bbe-a6f4-30ffc1bdc4a5",
      "volume": 1,
      "muted": false,
      "fadeFrom": 947,
      "fadeTo": 971
    },
    "shine": {
      "src": "asset://00b05305-98d7-430a-9e64-985be275837b",
      "volume": 1,
      "muted": false
    },
    "logoReveal": {
      "src": "asset://9e4a53f5-3007-4cdd-8f49-992db4ebc9d1",
      "volume": 1,
      "muted": false
    }
  },
  "motion": {
    "open": {
      "anchorX": 1920,
      "anchorY": 1080,
      "sourceWidth": 3840,
      "sourceHeight": 2160,
      "startFrame": -19.98,
      "endFrame": 42.956,
      "startX": 960,
      "startY": 540,
      "endX": 1020,
      "endY": 630,
      "startScale": 0.5,
      "endScale": 0.6,
      "interpolation": "linear"
    },
    "phone": {
      "anchorX": 1920,
      "anchorY": 1080,
      "sourceWidth": 3840,
      "sourceHeight": 2160,
      "startFrame": -1.043,
      "endFrame": 87.868,
      "startX": 450,
      "startY": 459,
      "endX": 264,
      "endY": 399,
      "startScale": 0.77,
      "endScale": 0.87,
      "interpolation": "linear"
    },
    "news_a": {
      "anchorX": 960,
      "anchorY": 544,
      "sourceWidth": 1920,
      "sourceHeight": 1088,
      "startFrame": 0,
      "endFrame": 0,
      "startX": 960,
      "startY": 540,
      "endX": 960,
      "endY": 540,
      "startScale": 1,
      "endScale": 1,
      "interpolation": "linear"
    },
    "news_b": {
      "anchorX": 960,
      "anchorY": 544,
      "sourceWidth": 1920,
      "sourceHeight": 1088,
      "startFrame": 0,
      "endFrame": 0,
      "startX": 960,
      "startY": 540,
      "endX": 960,
      "endY": 540,
      "startScale": 1,
      "endScale": 1,
      "interpolation": "linear"
    },
    "news_c": {
      "anchorX": 960,
      "anchorY": 544,
      "sourceWidth": 1920,
      "sourceHeight": 1088,
      "startFrame": 0,
      "endFrame": 0,
      "startX": 960,
      "startY": 540,
      "endX": 960,
      "endY": 540,
      "startScale": 1,
      "endScale": 1,
      "interpolation": "linear"
    },
    "hf_talk": {
      "anchorX": 960,
      "anchorY": 540,
      "sourceWidth": 1920,
      "sourceHeight": 1080,
      "startFrame": 0,
      "endFrame": 0,
      "startX": 960,
      "startY": 540,
      "endX": 960,
      "endY": 540,
      "startScale": 1.02045,
      "endScale": 1.02045,
      "interpolation": "linear"
    },
    "magnific": {
      "anchorX": 1273,
      "anchorY": 719,
      "sourceWidth": 2546,
      "sourceHeight": 1438,
      "startFrame": -6.998,
      "endFrame": 15.979,
      "startX": 960,
      "startY": 540,
      "endX": 960,
      "endY": 540,
      "startScale": 0.77,
      "endScale": 0.8,
      "interpolation": "linear"
    },
    "greenwide": {
      "anchorX": 1920,
      "anchorY": 1080,
      "sourceWidth": 3840,
      "sourceHeight": 2160,
      "startFrame": 0,
      "endFrame": 0,
      "startX": 1020,
      "startY": 576,
      "endX": 1020,
      "endY": 576,
      "startScale": 0.55,
      "endScale": 0.55,
      "interpolation": "linear"
    },
    "greentrack": {
      "anchorX": 1920,
      "anchorY": 1080,
      "sourceWidth": 3840,
      "sourceHeight": 2160,
      "startFrame": 0,
      "endFrame": 0,
      "startX": 1020,
      "startY": 576,
      "endX": 1020,
      "endY": 576,
      "startScale": 0.55,
      "endScale": 0.55,
      "interpolation": "linear"
    },
    "desk": {
      "anchorX": 960,
      "anchorY": 540,
      "sourceWidth": 1920,
      "sourceHeight": 1080,
      "startFrame": -9.989,
      "endFrame": 23.977,
      "startX": 960,
      "startY": 540,
      "endX": 960,
      "endY": 540,
      "startScale": 1,
      "endScale": 1.03,
      "interpolation": "linear"
    },
    "smartest": {
      "anchorX": 960,
      "anchorY": 544,
      "sourceWidth": 1920,
      "sourceHeight": 1088,
      "startFrame": -0.792,
      "endFrame": 32.175,
      "startX": 960,
      "startY": 540,
      "endX": 960,
      "endY": 513,
      "startScale": 1,
      "endScale": 1.05,
      "interpolation": "linear"
    },
    "blazer": {
      "anchorX": 1920,
      "anchorY": 1080,
      "sourceWidth": 3840,
      "sourceHeight": 2160,
      "startFrame": 0,
      "endFrame": 0,
      "startX": 1020,
      "startY": 579,
      "endX": 1020,
      "endY": 579,
      "startScale": 0.54,
      "endScale": 0.54,
      "interpolation": "linear"
    },
    "tripod_a": {
      "anchorX": 960,
      "anchorY": 540,
      "sourceWidth": 1920,
      "sourceHeight": 1080,
      "startFrame": 0.164,
      "endFrame": 28.136,
      "startX": 960,
      "startY": 540,
      "endX": 954,
      "endY": 531,
      "startScale": 1,
      "endScale": 1.06,
      "interpolation": "linear"
    },
    "tripod_b": {
      "anchorX": 960,
      "anchorY": 540,
      "sourceWidth": 1920,
      "sourceHeight": 1080,
      "startFrame": -4.851,
      "endFrame": 29.275,
      "startX": 960,
      "startY": 540,
      "endX": 954,
      "endY": 531,
      "startScale": 1,
      "endScale": 1.06,
      "interpolation": "linear"
    },
    "keynote_b": {
      "anchorX": 960,
      "anchorY": 544,
      "sourceWidth": 1920,
      "sourceHeight": 1088,
      "startFrame": 0,
      "endFrame": 0,
      "startX": 960,
      "startY": 540,
      "endX": 960,
      "endY": 540,
      "startScale": 1.075,
      "endScale": 1.075,
      "interpolation": "linear"
    },
    "grid_0": {
      "anchorX": 1920,
      "anchorY": 1080,
      "sourceWidth": 3840,
      "sourceHeight": 2160,
      "startFrame": 0,
      "endFrame": 0,
      "startX": 960,
      "startY": 540,
      "endX": 960,
      "endY": 540,
      "startScale": 0.5,
      "endScale": 0.5,
      "interpolation": "linear"
    },
    "grid_1": {
      "anchorX": 1920,
      "anchorY": 1080,
      "sourceWidth": 3840,
      "sourceHeight": 2160,
      "startFrame": -0.094,
      "endFrame": 60.845,
      "startX": 960,
      "startY": 540,
      "endX": 960,
      "endY": 540,
      "startScale": 0.5,
      "endScale": 0.52,
      "interpolation": "linear"
    },
    "split_0": {
      "anchorX": 960,
      "anchorY": 540,
      "sourceWidth": 1920,
      "sourceHeight": 1080,
      "startFrame": -6.993,
      "endFrame": 32.967,
      "startX": 960,
      "startY": 540,
      "endX": 490,
      "endY": 540,
      "startScale": 1,
      "endScale": 1,
      "interpolation": "smooth",
      "path0Frame": 0,
      "path0X": 960,
      "path0Y": 540,
      "path1Frame": 5,
      "path1X": 960,
      "path1Y": 540,
      "path2Frame": 8,
      "path2X": 700,
      "path2Y": 540,
      "path3Frame": 21,
      "path3X": 500,
      "path3Y": 540,
      "path4Frame": 33.2,
      "path4X": 490,
      "path4Y": 540
    },
    "split_1": {
      "anchorX": 960,
      "anchorY": 540,
      "sourceWidth": 1920,
      "sourceHeight": 1080,
      "startFrame": -6.993,
      "endFrame": 32.967,
      "startX": 2144,
      "startY": 540,
      "endX": 1764,
      "endY": 540,
      "startScale": 1,
      "endScale": 1,
      "interpolation": "smooth",
      "path0Frame": 0,
      "path0X": 2144,
      "path0Y": 540,
      "path1Frame": 5,
      "path1X": 2144,
      "path1Y": 540,
      "path2Frame": 8,
      "path2X": 1930,
      "path2Y": 540,
      "path3Frame": 21,
      "path3X": 1780,
      "path3Y": 540,
      "path4Frame": 33.2,
      "path4X": 1764,
      "path4Y": 540
    },
    "keynote_0": {
      "anchorX": 960,
      "anchorY": 544,
      "sourceWidth": 1920,
      "sourceHeight": 1088,
      "startFrame": 0,
      "endFrame": 0,
      "startX": 960,
      "startY": 540,
      "endX": 960,
      "endY": 540,
      "startScale": 1,
      "endScale": 1,
      "interpolation": "linear"
    },
    "keynote_1": {
      "anchorX": 960,
      "anchorY": 544,
      "sourceWidth": 1920,
      "sourceHeight": 1088,
      "startFrame": 0,
      "endFrame": 0,
      "startX": 960,
      "startY": 540,
      "endX": 960,
      "endY": 540,
      "startScale": 1,
      "endScale": 1,
      "interpolation": "linear"
    },
    "keynote_2": {
      "anchorX": 960,
      "anchorY": 1084,
      "sourceWidth": 1920,
      "sourceHeight": 1088,
      "startFrame": 0,
      "endFrame": 0,
      "startX": 992,
      "startY": 1080,
      "endX": 992,
      "endY": 1080,
      "startScale": 1.08,
      "endScale": 1.08,
      "interpolation": "linear"
    }
  },
  "features": {
    "grid": {
      "dark": {
        "wipe": "fast",
        "wipeFrom": 0,
        "wipeTo": 8,
        "darkFill": true
      },
      "video": {
        "wipe": "smooth",
        "wipeFrom": 0,
        "wipeTo": 17,
        "darkFill": false
      }
    },
    "split": {
      "rightMask": {
        "fromPosition": 2144,
        "toPosition": 1764,
        "fromEdge": 1920,
        "toEdge": 960,
        "canvasWidth": 1920
      }
    },
    "keynote": {
      "dark": {
        "wipe": "fast",
        "wipeFrom": -3,
        "wipeTo": 3,
        "darkFill": true
      },
      "middle": {
        "wipe": "fast",
        "wipeFrom": -4,
        "wipeTo": 8,
        "darkFill": false
      },
      "close": {
        "wipe": "fast",
        "wipeFrom": -4,
        "wipeTo": 8,
        "darkFill": false
      }
    }
  },
  "overlays": {
    "caption-show": {
      "text": "Your show looks like a",
      "xPx": 961.608,
      "yPx": 519.78,
      "textOpacity": 1,
      "animStartFrame": 0,
      "animEndFrame": 70.929,
      "fontSize": 68,
      "fontWeight": 800,
      "color": "#ffffff",
      "background": "transparent"
    },
    "caption-monday": {